vuln-id,filepath,moudle,line,Finding,Security impact
29,../opentitan/hw/ip/hmac/rtl/hmac_reg_top.sv,hmac,2622-2624,"At ../opentitan/hw/ip/hmac/rtl/hmac_reg_top.sv:2622-2624, the default arm of a case (1'b1) one-hot read-data mux drives reg_rdata_next with reg2hw.key[2].q. When no addr_hit bit is definitively 1 (unmapped read, decode miss, or X/Z), the default fires, creating a direct combinational path from a secret key word to the TL-UL read-data bus. Although addrmiss is computed, it is not used to force a safe value or to assert a bus error.","Direct information exposure of a 32-bit HMAC key word (CWE-200). Any unmapped read returns key[2], leaking secret material on the system bus. Fault/glitch or X-propagation can reliably force the default path to amplify leakage. Even partial key disclosure materially reduces entropy and can enable HMAC forgery or accelerate offline key recovery."
30,../opentitan/hw/ip/entropy_src/rtl/entropy_src_markov_ht.sv,entropy,158-159,"In entropy_src_markov_ht, the Markov health test's failure signals are functionally disabled: test_fail_hi_pulse_o and test_fail_lo_pulse_o are hardwired to 1'b0 (../opentitan/hw/ip/entropy_src/rtl/entropy_src_markov_ht.sv:158-159), and the module never compares computed transition statistics (pair_cntr_min/max/sum or rng_bit_cnt) against thresh_hi_i/thresh_lo_i at window boundaries.","Complete loss of the Markov health check allows highly correlated or toggling bit streams to pass as healthy, degrading entropy quality and enabling prediction of downstream random values. Alerting/telemetry based on Markov failures will never trigger, undermining monitoring and potentially weakening compliance and certification arguments."
31,../opentitan/hw/ip/aes/rtl/aes_key_expand.sv,aes,393-423,"In aes_key_expand.sv (lines 393-423), the AES-256 key-schedule update is incorrectly gated on (rnd != 0) with a passthrough default regular[s] = key_i[s]. As a result, at rnd == 0 both CIPH_FWD and CIPH_INV skip the required first scheduling step, causing the next 256-bit window to not be generated. This makes the round-1 subkey reuse the round-0 subkey (violating AES-256 SubWord/RotWord/Rcon semantics) for both encryption and decryption paths.","The defect breaks FIPS-197 AES-256 compliance and causes identical subkeys to be applied in consecutive rounds. This structural flaw significantly weakens security by enabling more efficient cryptanalysis (e.g., two-round meet-in-the-middle and differential/boomerang attacks leveraging repeated subkeys) compared to standard AES-256. If both endpoints use the flawed IP, communications may appear to work while providing materially reduced security; when interoperating with a correct implementation, operations fail. Countermeasure assumptions (masking, control-flow) may also be impacted due to altered leakage patterns."
32,../opentitan/hw/ip/kmac/rtl/kmac_core.sv,kmac,153-188,"The KMAC core FSM leaves StKmacIdle on (kmac_en_i && start_i) without requiring key_valid_i, enabling en_key_write/en_kmac_datapath with potentially stale or uninitialized key material. key_valid_i is only referenced in an unused tie-off and verification-only assumptions, providing no runtime enforcement. Relevant code: L153 (unused XOR tie-off), L181-L188 (Idle->StKey transition ungated by key readiness), L193-L195 (datapath/key write enable), and assumptions at L476-L477. This violates initialization requirements (CWE-665) and creates TOCTOU risk during key updates","KMAC operations can proceed under stale, partially programmed, or zero/default keys, enabling unauthorized MAC/KDF outputs and breaking inter-session key isolation. A software adversary can compute MACs under a prior context's key or induce outputs before proper provisioning. The TOCTOU window allows mixed-key operation if start_i coincides with key updates. Driving the datapath with an unintended secret increases side-channel exposure. Protocols relying on KMAC integrity/authorization may accept outputs generated under a prohibited key, undermining security guarantees"
33,../opentitan/hw/ip/mbx/rtl/mbx_imbx.sv,mbx,"22,79-80,87,119","mbx_imbx.sv uses the raw hostif_control_abort_clear_i (L22) as a privileged control across several critical paths without any authorization or state gating. Specifically: host_clear_abort = hostif_control_abort_clear_i & mbx_sys_abort (L79-L81); load_write_ptr = mbx_empty | host_clear_abort | mbx_read (L87); and clear_pending = hostif_sram_write_gnt_i | hostif_control_abort_clear_i (L119). This constitutes improper access control (CWE-284) and incomplete gating semantics, allowing any writer of the abort_clear bit to clear pending, acknowledge aborts, and rewind the write pointer irrespective of ownership or an active abort window","An unprivileged MMIO writer can: (1) cause denial of service by repeatedly clearing imbx_pending_o even when no abort is active, descheduling legitimate writes and inducing livelock; (2) cause data integrity loss by forcing pointer reloads during active writes when mbx_sys_abort=1, corrupting messages and desynchronizing producer/consumer state; (3) bypass intended control flow by unilaterally acknowledging aborts and advancing FSM-related state, undermining higher-level recovery logic; and (4) degrade integrity/availability guarantees in mailbox flow control (overflow/backpressure), potentially leading to silent drops or hard-to-recover error states"
34,../opentitan/hw/ip/otp_ctrl/rtl/otp_ctrl_pkg.sv,otp,157-163,"The parameter FLASH_OTP_KEY_RSP_DEFAULT in ../opentitan/hw/ip/otp_ctrl/rtl/otp_ctrl_pkg.sv:157-163 uses obfuscated constant expressions that evaluate to data_ack=1, addr_ack=0, seed_valid=1, key=0...0, rand_key=0...0. Because it is intended as a tie-off for dangling connections, consumers can observe ""acknowledged and valid"" key material while the key is all zeros, creating a fail-open condition that can bypass key-provisioning logic (CWE-670: Always-Enabled/Improperly Controlled Feature)","Downstream FSMs that gate on seed_valid and ack may proceed with a zero-valued key, weakening or disabling flash scrambling. A zero key can yield predictable or identity transforms, exposing flash contents and enabling tampering. The unsafe default can also mask wiring/integration issues, allowing builds or lifecycle/debug modes to ship with effectively unscrambled flash. Attackers can induce fallback to the default by glitching, reset timing, or provoking OTP faults (e.g., ECC errors), then extract or modify data with little resistance"
35,../opentitan/hw/ip/spi_device/rtl/spi_tpm.sv,spi,805-810,"invalid_locality is computed from the prior cycle's locality due to non-blocking assignment semantics in the locality store block (L800-L809). The assignment uses locality (old value) instead of the newly latched addr[15:12], creating a one-cycle TOCTOU mismatch between locality and its validity flag that gates HW register access and TPM_STATUS readback","Improper access control (CWE-284/285): a host can read HW-managed TPM registers at unsupported localities by priming invalid_locality with a valid locality and immediately accessing an invalid one. The HW-return gate (L766-L767) and RegSts path (L964-L970) will authorize based on a stale, low invalid_locality, enabling unauthorized HW-return of TPM registers and bypassing the FFh error path (L1195-L1199). For RegSts, truncation via locality[2:0] can alias an invalid locality to an enabled bit, increasing leakage risk. The reset default of invalid_locality=0 also permits an unauthorized first access after reset if the first transaction targets an invalid locality. Net effect: locality policy is violated, enabling unintended disclosure of TPM status/regs and undermining the TPM's locality protection boundary"
36,../opentitan/hw/ip/uart/rtl/uart_core.sv,uart,336-355,"The RX FIFO watermark threshold logic mishandles both reserved RXILVL encodings and shift sizing: (A) RXILVL=7 (reserved) sets rx_thresh_val to all-ones (127 for width 7), yielding an unreachable threshold that silently disables the watermark; (B) rx_thresh_val = 1'b1 << uart_fifo_rxilvl uses a 1-bit left operand so shifts >0 collapse to 0, causing the watermark to assert permanently for RXILVL=1..5. The intended power-of-two mapping with saturation is not correctly implemented","An attacker can deterministically induce denial-of-service or data-loss conditions via software control of RXILVL. Using the reserved value (7) disables the RX watermark interrupt, allowing RX overflow and loss of inbound data if software depends on the interrupt for servicing. Using levels 1..5 under strict SV sizing can create an always-true watermark, flooding the interrupt subsystem, starving other ISRs, and potentially livelocking the CPU. These effects can degrade availability, mask higher-priority events, and bypass higher-level controls relying on timely UART receive processing (e.g., logging, authentication, recovery prompts)"
37,../opentitan/hw/ip/uart/rtl/uart_core.sv,uart,356-364,"In uart_core.sv L356-L364, lsio_trigger_o is reset low and then unconditionally driven high on the first clock after reset (always_ff @(posedge clk_i or negedge rst_ni) if (!rst_ni) lsio_trigger_o <= 1'b0; else lsio_trigger_o <= 1'b1;). This ignores event_rx_watermark and any TX watermark/timeout logic, enable bits, or DMA handshake, collapsing the LSIO DMA request into a permanent 'not-in-reset' indicator","Permanent assertion of the LSIO DMA request enables system-wide denial of service by keeping a DMA channel continuously active, consuming arbitration slots and bus bandwidth and degrading QoS. It risks data integrity by forcing RX reads when the FIFO is empty (stale data, stalls, or aborts) and TX writes regardless of availability (drops, overflow, unintended transmission). If DMA addressability is not constrained (e.g., no IOMMU/PMP), a malicious configuration can lead to memory corruption. The bug bypasses the intended watermark/timeout flow-control policy, raising power and potentially wedging the interconnect under backpressure"
38,../opentitan/hw/ip/hmac/rtl/hmac.sv,hmac,842-858,"The HMAC error reporting logic (err_valid) includes invalid_config_atstart as a trigger. However, the priority case assigning err_code does not handle this condition. As a result, the design may assert the hmac_err interrupt while writing ERR_CODE = NoError. This violates the first-event latching guarantee intended for firmware to diagnose the root cause of the error. The issue is compounded by a duplicated hash_start_sha_disabled case item, leaving dead code.","An error interrupt can be raised with ERR_CODE=NoError, yielding ambiguous/false reporting (CWE-754). Because subsequent error latching is blocked while an interrupt is pending, an attacker can trigger invalid_config_atstart to mask later, more meaningful violations (e.g., update_seckey_inprocess, msg_push_not_allowed) until software clears the interrupt. This enables error cloaking, degrades diagnostics, increases interrupt load, and creates an audit blind spot by hiding the root cause and subsequent misuse."
39,../opentitan/hw/ip/hmac/rtl/hmac_reg_top.sv,hmac,2127-2128,"The WIPE_SECRET CSR write-enable signal is gated using reg_error instead of !reg_error. This polarity inversion causes WIPE_SECRET to be unwritable during normal operation (reg_error=0) and writable only during bus error conditions (reg_error=1). This behavior diverges from neighboring CSRs, which correctly block writes only when reg_error is asserted.","Confidentiality risk via incomplete zeroization (CWE-459): secrets and intermediate state intended to be scrubbed remain resident, extending their exposure window to side-channel, fault-injection, or later forensic extraction. Inconsistent ../opentitan/hw/SW semantics: zeroization can occur precisely when the bus reports an error, desynchronizing software expectations from hardware state and complicating recovery/rollback logic. Broader defense degradation (CWE-693): the primary software-triggered wipe mechanism is nonfunctional in normal conditions, undermining a key containment control. Potential availability impact: retries after error may cause unexpected timing of wipes if the first attempt silently succeeded."
